English,IPA,Vietnamese,Part of Speech,V2 (Past),V3 (Past Participle),S/ES,Example Sentence,Description,Collocation,Synonyms,Antonyms,CEFR Level,Topic,Quiz Question
number,'n?mb?r,s?,noun,-,-,numbers,What is your phone number?,A symbol or word that represents a quantity.,"phone number, lucky number, number one","digit, figure, amount","letter, word",A1,Numbers & Time,'Phone ___' — di?n t?: | A: name | B: color | C: number | D: size | Šįp įn: C
color,'k?l?r,mąu s?c,noun,-,-,colors,What is your favorite color?,The visual appearance of something based on light.,"bright color, dark color, favorite color","shade, hue, tone","black and white, colorless",A1,Colors,'Bright ___' — di?n t?: | A: size | B: age | C: color | D: word | Šįp įn: C
street,stri?t,du?ng ph?,noun,-,-,streets,She lives on a quiet street.,A public road in a town or city.,"main street, busy street, walk the street","road, avenue, lane","highway, field",A1,City & Places,'Main ___' — di?n t?: | A: shop | B: street | C: hotel | D: office | Šįp įn: B
shop,??p,c?a hąng,noun,-,-,shops,I go to the shop every morning.,A place where goods are sold.,"coffee shop, gift shop, go shopping","store, market, boutique","home, warehouse",A1,City & Places,'Gift ___' — di?n t?: | A: hotel | B: office | C: street | D: shop | Šįp įn: D
class,kl??s,l?p h?c,noun,-,-,classes,The class starts at 8 AM.,A group of students taught together.,"English class, class room, take a class","lesson, course, session","break, holiday",A1,Education,'English ___' — di?n t?: | A: sport | B: movie | C: class | D: job | Šįp įn: C
sport,sp??rt,th? thao,noun,-,-,sports,He plays sport every weekend.,A physical activity done for exercise or fun.,"team sport, water sport, play sport","game, activity, exercise","rest, leisure",A1,Entertainment & Leisure,'Team ___' — di?n t?: | A: movie | B: sport | C: game | D: photo | Šįp įn: B
movie,'mu?vi,phim,noun,-,-,movies,Let's watch a movie tonight.,A story recorded as a film to be shown.,"watch a movie, action movie, movie star","film, picture, cinema","book, play",A1,Entertainment & Leisure,'Action ___' — di?n t?: | A: sport | B: song | C: movie | D: game | Šįp įn: C
hotel,ho?'t?l,khįch s?n,noun,-,-,hotels,We stayed at a nice hotel.,A building where guests pay to stay overnight.,"luxury hotel, hotel room, book a hotel","inn, resort, lodge","home, camp",A1,City & Places,'Luxury ___' — di?n t?: | A: shop | B: office | C: street | D: hotel | Šįp įn: D
office,'?f?s,van phņng,noun,-,-,offices,She works in a big office.,A room or building used for administrative work.,"home office, office desk, go to the office","workplace, bureau, studio","home, field",A2,City & Places,'Home ___' — di?n t?: | A: hotel | B: office | C: shop | D: class | Šįp įn: B
letter,'l?t?r,lį thu,noun,-,-,letters,She wrote a letter to her friend.,A written message sent to someone.,"write a letter, love letter, open a letter","note, message, email","email, call",A1,Greetings & Communication,'Write a ___' — di?n t?: | A: photo | B: language | C: letter | D: idea | Šįp įn: C
price,pra?s,giį c?,noun,-,-,prices,What is the price of this bag?,The amount of money needed to buy something.,"low price, high price, price tag","cost, fee, charge","free, discount",A2,Work & Money,'Low ___' — di?n t?: | A: job | B: price | C: age | D: size | Šįp įn: B
job,d??b,cōng vi?c,noun,-,-,jobs,She got a new job last month.,A paid position of employment.,"full-time job, job interview, find a job","work, career, occupation","hobby, leisure",A1,Work & Money,'Find a ___' — di?n t?: | A: price | B: photo | C: job | D: idea | Šįp įn: C
photo,'fo?to?,?nh,noun,-,-,photos,She took a photo of the sunset.,An image captured by a camera.,"take a photo, group photo, photo album","picture, image, snapshot","painting, drawing",A1,Entertainment & Leisure,'Take a ___' — di?n t?: | A: idea | B: photo | C: problem | D: place | Šįp įn: B
language,'lę?gw?d?,ngōn ng?,noun,-,-,languages,English is a global language.,A system of words used to communicate.,"learn a language, spoken language, sign language","tongue, dialect, speech","silence, gesture",A2,Greetings & Communication,'Learn a ___' — di?n t?: | A: sport | B: movie | C: language | D: hotel | Šįp įn: C
weather,'w?š?r,th?i ti?t,noun,-,-,-,The weather today is very nice.,The condition of the atmosphere at a given time.,"bad weather, warm weather, weather forecast","climate, conditions, atmosphere",—,A1,Nature & Weather,'Bad ___' — di?n t?: | A: animal | B: weather | C: idea | D: problem | Šįp įn: B
animal,'ęn?m?l,d?ng v?t,noun,-,-,animals,A dog is a friendly animal.,A living creature that is not a plant or human.,"wild animal, pet animal, animal shelter","creature, beast, wildlife","plant, human",A1,Animals,'Wild ___' — di?n t?: | A: animal | B: weather | C: idea | D: dream | Šįp įn: A
idea,a?'di??,ż tu?ng,noun,-,-,ideas,That is a great idea!,A thought or suggestion about something.,"good idea, share an idea, come up with an idea","thought, concept, plan","reality, fact",A2,Thinking & Feelings,'Good ___' — di?n t?: | A: problem | B: idea | C: way | D: place | Šįp įn: B
problem,'pr?bl?m,v?n d?,noun,-,-,problems,We have a big problem.,A matter that is difficult to deal with.,"big problem, solve a problem, no problem","issue, difficulty, challenge","solution, answer, ease",A2,Thinking & Feelings,'Solve a ___' — di?n t?: | A: idea | B: way | C: problem | D: word | Šįp įn: C
place,ple?s,noi ch?n,noun,-,-,places,This is a beautiful place.,A particular area or location.,"nice place, birth place, take place","location, spot, area","nowhere, void",A1,City & Places,'Birth ___' — di?n t?: | A: way | B: place | C: word | D: minute | Šįp įn: B
way,we?,"cįch, du?ng",noun,-,-,ways,Is this the right way?,"A method of doing something, or a route.","right way, find a way, on the way","method, route, path","dead end, obstacle",A1,Common Words,'Right ___' — di?n t?: | A: word | B: minute | C: week | D: way | Šįp įn: D
word,w??rd,t?,noun,-,-,words,What does this word mean?,A unit of language that carries meaning.,"new word, key word, in other words","term, expression, vocabulary","silence, gesture",A1,Greetings & Communication,'Key ___' — di?n t?: | A: word | B: minute | C: year | D: week | Šįp įn: A
minute,'m?n?t,phśt,noun,-,-,minutes,Please wait a minute.,A unit of time equal to 60 seconds.,"one minute, last minute, wait a minute","moment, second, instant","hour, day",A1,Numbers & Time,'Wait a ___' — di?n t?: | A: hour | B: year | C: minute | D: week | Šįp įn: C
year,j??r,nam,noun,-,-,years,I have studied English for one year.,A period of 12 months.,"last year, new year, this year","period, calendar year, decade","day, month, moment",A1,Numbers & Time,'New ___' — di?n t?: | A: week | B: year | C: day | D: age | Šįp įn: B
week,wi?k,tu?n,noun,-,-,weeks,I go to gym three times a week.,A period of seven days.,"last week, next week, every week","fortnight, period","day, year",A1,Numbers & Time,'Last ___' — di?n t?: | A: year | B: minute | C: week | D: age | Šįp įn: C
age,e?d?,tu?i,noun,-,-,ages,What is your age?,The number of years someone has lived.,"old age, middle age, age group","years, era, period","youth, infancy",A2,Numbers & Time,'Old ___' — c?m t? nąo dśng? | A: age group | B: age car | C: age tree | D: age river | Šįp įn: A
size,sa?z,kķch c?,noun,-,-,sizes,What size is this shirt?,The measurement of how big something is.,"shoe size, large size, size up","measurement, dimension, scale","shapeless, undefined",A2,Clothing & Accessories,'Shoe ___' — di?n t?: | A: age | B: size | C: color | D: number | Šįp įn: B
dream,dri?m,gi?c mo,noun,dreamed/dreamt,dreamed/dreamt,dreams,I had a strange dream last night.,Images or events experienced during sleep.,"sweet dream, dream come true, day dream","vision, aspiration, hope","reality, nightmare, wakefulness",A2,Entertainment & Leisure,'Sweet ___' — di?n t?: | A: idea | B: problem | C: dream | D: way | Šįp įn: C
smile,sma?l,m?m cu?i,verb,smiled,smiled,smiles,She smiled when she saw him.,To turn the corners of your mouth upward to show happiness.,"smile back, big smile, smile at someone","grin, beam, laugh","frown, scowl, cry",A1,Health & Body,'Smile ___' — c?m t? nąo dśng? | A: smile at someone | B: smile a house | C: smile a river | D: smile a mountain | Šįp įn: A
cry,kra?,khóc,verb,cried,cried,cries,The baby cried all night.,To shed tears because of sadness or pain.,"cry out, cry loudly, cry for help","weep, sob, wail","laugh, smile, cheer",A1,Health & Body,T? trįi nghia c?a 'cry' lą gģ? | A: weep | B: sob | C: wail | D: laugh | Šįp įn: D
laugh,l??f,cu?i l?n,verb,laughed,laughed,laughs,They laughed at the funny joke.,To make sounds showing you find something funny.,"laugh out loud, have a laugh, laugh together","chuckle, giggle, burst out laughing","cry, frown, sob",A1,Entertainment & Leisure,T? d?ng nghia c?a 'laugh' lą gģ? | A: cry | B: frown | C: giggle | D: sob | Šįp įn: C
wait,we?t,ch? d?i,verb,waited,waited,waits,Please wait here for a moment.,To stay in a place until something happens.,"wait for, wait in line, wait a moment","hold on, stay, pause","go, rush, hurry",A1,Actions & Movement,'Wait ___' — c?m t? nąo dśng? | A: wait in line | B: wait a mountain | C: wait a fire | D: wait a flower | Šįp įn: A
stop,st?p,d?ng l?i,verb,stopped,stopped,stops,Stop the car right now.,To no longer move or continue doing something.,"stop doing, stop sign, bus stop","halt, pause, end","start, go, continue",A1,Actions & Movement,T? trįi nghia c?a 'stop' lą gģ? | A: halt | B: pause | C: start | D: end | Šįp įn: C
start,st??rt,b?t d?u,verb,started,started,starts,The movie starts at 7 PM.,To begin an action or process.,"start work, fresh start, head start","begin, commence, launch","stop, end, finish",A1,Actions & Movement,T? trįi nghia c?a 'start' lą gģ? | A: begin | B: launch | C: stop | D: commence | Šįp įn: C
finish,'f?n??,hoąn thąnh,verb,finished,finished,finishes,I finished my homework.,To complete something or reach the end.,"finish line, finish work, finish early","complete, end, conclude","start, begin, continue",A1,Actions & Movement,T? d?ng nghia c?a 'finish' lą gģ? | A: begin | B: start | C: complete | D: continue | Šįp įn: C
travel,'tręv?l,du l?ch,verb,traveled,traveled,travels,She loves to travel abroad.,"To go from one place to another, usually far.","travel abroad, travel light, travel by plane","journey, trip, voyage","stay home, settle",A2,Transport & Travel,'Travel ___' — c?m t? nąo dśng? | A: travel abroad | B: travel a book | C: travel a chair | D: travel a wall | Šįp įn: A
return,r?'t??rn,tr? v?,verb,returned,returned,returns,He returned home late.,To come or go back to a place.,"return home, return ticket, point of no return","come back, go back, get back","leave, depart, go away",A2,Transport & Travel,'Return ___' — di?n t?: | A: home | B: a flower | C: a cloud | D: a star | Šįp įn: A
change,t?e?nd?,thay d?i,verb,changed,changed,changes,Things change over time.,To become different or make something different.,"make a change, climate change, change mind","alter, switch, modify","keep, maintain, stay the same",A2,Thinking & Feelings,'Climate ___' — di?n t?: | A: idea | B: change | C: dream | D: problem | Šįp įn: B
choose,t?u?z,l?a ch?n,verb,chose,chosen,chooses,You can choose any color you like.,To pick one from several options.,"choose carefully, hard to choose, choose wisely","select, pick, decide on","reject, refuse, ignore",A2,Thinking & Feelings,T? d?ng nghia c?a 'choose' lą gģ? | A: reject | B: refuse | C: select | D: ignore | Šįp įn: C
use,ju?z,s? d?ng,verb,used,used,uses,Can I use your pen?,To put something into service or action.,"use correctly, make use of, use up","employ, apply, utilize","misuse, waste, abandon",A1,Thinking & Feelings,'Make ___ of' — di?n t?: | A: use | B: find | C: know | D: ask | Šįp įn: A
watch,w?t?,"xem, nhģn",verb,watched,watched,watches,I like to watch movies.,To look at something for a period of time.,"watch TV, watch out, watch carefully","observe, look at, view","ignore, overlook, miss",A1,Thinking & Feelings,'Watch ___' — t? nąo phł h?p? | A: a cloud | B: TV | C: a flower | D: a mountain | Šįp įn: B
learn,l??rn,h?c,verb,learned,learned,learns,Children learn quickly.,To gain knowledge or a skill through experience.,"learn English, learn by heart, learn from","study, acquire, pick up","forget, unlearn, ignore",A1,Education,'Learn by ___' — di?n t?: | A: mind | B: eye | C: heart | D: hand | Šįp įn: C
tell,t?l,"k?, nói",verb,told,told,tells,Please tell me the answer.,To communicate information to someone.,"tell a story, tell the truth, tell someone","say, inform, explain","hide, keep secret, listen",A1,Greetings & Communication,'Tell a ___' — c?m t? nąo dśng? | A: tell a story | B: tell a mountain | C: tell a flower | D: tell a rain | Šįp įn: A
show,?o?,"ch?, cho xem",verb,showed,shown,shows,Show me your passport please.,To let someone see something.,"show off, art show, show up","display, demonstrate, reveal","hide, conceal, cover",A1,Thinking & Feelings,T? d?ng nghia c?a 'show' lą gģ? | A: hide | B: conceal | C: display | D: cover | Šįp įn: C
bring,br??,mang d?n,verb,brought,brought,brings,Bring your umbrella today.,To carry something to a place.,"bring along, bring back, bring up","carry, fetch, deliver","take away, remove, leave",A1,Actions & Movement,'Bring ___' — c?m t? nąo dśng? | A: bring along | B: bring a mountain | C: bring a river | D: bring a sky | Šįp įn: A
keep,ki?p,gi?,verb,kept,kept,keeps,"Keep the change, please.",To continue doing or having something.,"keep safe, keep going, keep in touch","hold, maintain, retain","give away, lose, release",A1,Actions & Movement,'Keep ___' — c?m t? nąo dśng? | A: keep going | B: keep a river | C: keep a mountain | D: keep a rain | Šįp įn: A
move,mu?v,di chuy?n,verb,moved,moved,moves,The car moved slowly.,To go from one place to another.,"move out, move in, keep moving","shift, transfer, relocate","stay, stop, remain",A1,Actions & Movement,T? d?ng nghia c?a 'move' lą gģ? | A: stay | B: stop | C: remain | D: shift | Šįp įn: D
pay,pe?,tr? ti?n,verb,paid,paid,pays,I will pay for dinner tonight.,To give money in exchange for something.,"pay attention, pay back, pay in cash","spend, settle, foot the bill","receive, earn, owe",A2,Work & Money,'Pay ___' — c?m t? nąo dśng? | A: pay attention | B: pay a river | C: pay a mountain | D: pay a cloud | Šįp įn: A
dirty,'d??rti,b?n,adjective,-,-,-,His hands were very dirty.,Not clean; covered in dirt.,"get dirty, dirty clothes, dirty water","filthy, messy, muddy","clean, spotless, tidy",A1,Descriptive Words,T? trįi nghia c?a 'dirty' lą gģ? | A: filthy | B: messy | C: clean | D: muddy | Šįp įn: C
sick,s?k,b?nh,adjective,-,-,-,She stayed home because she was sick.,Not well; suffering from illness.,"feel sick, very sick, sick leave","ill, unwell, poorly","healthy, well, fit",A1,Health & Body,'Feel ___' — di?n t?: | A: healthy | B: strong | C: sick | D: safe | Šįp įn: C
healthy,'h?l?i,kh?e m?nh,adjective,-,-,-,Eating vegetables keeps you healthy.,Having good physical condition.,"stay healthy, healthy diet, healthy lifestyle","fit, well, active","sick, ill, unhealthy",A1,Health & Body,T? trįi nghia c?a 'healthy' lą gģ? | A: fit | B: well | C: sick | D: active | Šįp įn: C
safe,se?f,an toąn,adjective,-,-,-,Is this road safe to walk on?,Protected from danger or harm.,"feel safe, safe place, safe journey","secure, protected, harmless","dangerous, unsafe, risky",A2,Descriptive Words,T? trįi nghia c?a 'safe' lą gģ? | A: secure | B: dangerous | C: protected | D: harmless | Šįp įn: B
dangerous,'de?nd??r?s,nguy hi?m,adjective,-,-,-,Driving fast is very dangerous.,Likely to cause harm or injury.,"very dangerous, dangerous road, dangerous animal","risky, unsafe, hazardous","safe, secure, harmless",A2,Descriptive Words,T? trįi nghia c?a 'dangerous' lą gģ? | A: risky | B: hazardous | C: safe | D: unsafe | Šįp įn: C
rich,r?t?,giąu có,adjective,-,-,-,She comes from a rich family.,Having a lot of money or valuable possessions.,"get rich, rich family, filthy rich","wealthy, affluent, well-off","poor, broke, needy",A2,Work & Money,T? trįi nghia c?a 'rich' lą gģ? | A: wealthy | B: affluent | C: poor | D: well-off | Šįp įn: C
poor,p??r,nghčo,adjective,-,-,-,Many poor families need support.,Having little or no money.,"poor family, very poor, poor condition","needy, broke, destitute","rich, wealthy, affluent",A2,Work & Money,T? trįi nghia c?a 'poor' lą gģ? | A: needy | B: broke | C: rich | D: destitute | Šįp įn: C
long,l??,dąi,adjective,-,-,-,She has long hair.,Having great length or duration.,"long road, long time, how long","lengthy, extended, prolonged","short, brief, quick",A1,Descriptive Words,T? trįi nghia c?a 'long' lą gģ? | A: lengthy | B: extended | C: short | D: prolonged | Šįp įn: C
wide,wa?d,r?ng,adjective,-,-,-,The road is very wide here.,Having a large distance from side to side.,"wide road, wide open, wide range","broad, large, spacious","narrow, thin, tight",A2,Descriptive Words,T? trįi nghia c?a 'wide' lą gģ? | A: broad | B: spacious | C: large | D: narrow | Šįp įn: D
heavy,'h?vi,n?ng,adjective,-,-,-,This bag is too heavy to carry.,Having great weight.,"heavy rain, too heavy, heavy traffic","weighty, massive, bulky","light, featherweight",A2,Descriptive Words,T? trįi nghia c?a 'heavy' lą gģ? | A: weighty | B: massive | C: light | D: bulky | Šįp įn: C
late,le?t,"mu?n, tr?",adjective,-,-,-,"Sorry, I am late today.",After the expected or usual time.,"arrive late, late night, better late than never","overdue, behind, delayed","early, on time, punctual",A1,Descriptive Words,T? trįi nghia c?a 'late' lą gģ? | A: overdue | B: delayed | C: early | D: behind | Šįp įn: C
early,'??rli,s?m,adjective,-,-,-,She woke up early this morning.,Before the expected or usual time.,"early morning, wake up early, early bird","ahead, prompt, timely","late, overdue, delayed",A1,Descriptive Words,'Early ___' — c?m t? nąo dśng? | A: early bird | B: early river | C: early mountain | D: early sea | Šįp įn: A
right,ra?t,"dśng, ph?i",adjective,-,-,-,That is the right answer.,Correct or on the correct side.,"right now, right side, all right","correct, accurate, true","wrong, incorrect, left",A1,Descriptive Words,'All ___' — di?n t?: | A: wrong | B: left | C: right | D: correct | Šįp įn: C
left,l?ft,trįi,adjective,-,-,-,Turn left at the traffic light.,On or toward the side of the body that faces west.,"turn left, left side, left hand",—,right,A1,Descriptive Words,T? trįi nghia c?a 'left' lą gģ? | A: left hand | B: right | C: left side | D: turn left | Šįp įn: B
full,f?l,"no, d?y",adjective,-,-,-,"I am full, I can't eat anymore.",Containing as much as possible; having eaten enough.,"full of, feel full, full moon","complete, packed, stuffed","empty, hungry, hollow",A1,Food & Drink,T? trįi nghia c?a 'full' lą gģ? | A: complete | B: packed | C: empty | D: stuffed | Šįp įn: C
empty,'?mpti,r?ng,adjective,-,-,-,The bottle is empty.,Containing nothing; having no one inside.,"empty space, run empty, empty stomach","hollow, vacant, bare","full, packed, occupied",A1,Descriptive Words,T? trįi nghia c?a 'empty' lą gģ? | A: hollow | B: vacant | C: full | D: bare | Šįp įn: C
same,se?m,gi?ng nhau,adjective,-,-,-,We have the same opinion.,Identical; not different.,"same time, same place, feel the same","identical, alike, equal","different, opposite, unique",A1,Descriptive Words,T? trįi nghia c?a 'same' lą gģ? | A: identical | B: alike | C: equal | D: different | Šįp įn: D
different,'d?fr?nt,khįc nhau,adjective,-,-,-,We have very different ideas.,Not the same as another.,"very different, look different, think different","unlike, distinct, varied","same, identical, similar",A1,Descriptive Words,T? d?ng nghia c?a 'different' lą gģ? | A: same | B: identical | C: distinct | D: equal | Šįp įn: C
together,t?'g?š?r,cłng nhau,adverb,-,-,-,We work better together.,With another person or people.,"work together, stay together, together with","jointly, collectively, as one","alone, separately, apart",A1,Family & Relationships,T? trįi nghia c?a 'together' lą gģ? | A: jointly | B: alone | C: collectively | D: as one | Šįp įn: B
again,?'g?n,"l?i, m?t l?n n?a",adverb,-,-,-,Please say that again.,Once more; another time.,"try again, do it again, come back again","once more, anew","never again, once",A1,Common Words,'Try ___' — di?n t?: | A: maybe | B: also | C: again | D: here | Šįp įn: C
also,'??lso?,cung,adverb,-,-,-,I also like coffee.,In addition; too.,"also known as, I also, not only…but also","too, as well, additionally","neither, nor, exclude",A1,Common Words,'Also' có nghia lą gģ? | A: Khōng bao gi? | B: Có l? | C: Cung | D: Luōn luōn | Šįp įn: C
here,h??r,? dāy,adverb,-,-,-,"Come here, please.",In or to this place.,"right here, over here, here and there","in this place, at this spot","there, away, elsewhere",A1,City & Places,'Come ___' — di?n t?: | A: there | B: here | C: now | D: also | Šįp įn: B
there,š??r,? dó,adverb,-,-,-,Put the bag over there.,In or to that place.,"over there, right there, here and there","at that place, yonder","here, nearby",A1,City & Places,T? trįi nghia c?a 'there' lą gģ? | A: over there | B: yonder | C: here | D: that place | Šįp įn: C
now,na?,bāy gi?,adverb,-,-,-,I am busy right now.,At the present time.,"right now, by now, now and then","currently, at present, today","later, then, before",A1,Numbers & Time,'Right ___' — di?n t?: | A: maybe | B: also | C: again | D: now | Šįp įn: D
today,t?'de?,hōm nay,adverb,-,-,-,Today is a beautiful day.,On this current day.,"today morning, earlier today, later today","this day, currently","yesterday, tomorrow",A1,Numbers & Time,'Today' có nghia lą gģ? | A: Hōm qua | B: Ngąy mai | C: Hōm nay | D: Tu?n t?i | Šįp įn: C
yesterday,'j?st?rde?,hōm qua,adverb,-,-,-,I met her yesterday.,The day before today.,"just yesterday, yesterday morning, yesterday evening",the day before,"today, tomorrow",A1,Numbers & Time,T? trįi nghia c?a 'yesterday' lą gģ? | A: today | B: now | C: tomorrow | D: this day | Šįp įn: C
tomorrow,t?'m?ro?,ngąy mai,adverb,-,-,-,See you tomorrow!,The day after today.,"tomorrow morning, see you tomorrow, tomorrow night","the next day, day after","today, yesterday",A1,Numbers & Time,'See you ___' — di?n t?: | A: yesterday | B: today | C: now | D: tomorrow | Šįp įn: D
maybe,'me?bi,có l?,adverb,-,-,-,Maybe I will come to the party.,Possibly; used when unsure.,"maybe not, maybe so, maybe later","perhaps, possibly, probably","definitely, certainly, never",A1,Thinking & Feelings,'Maybe' có nghia lą gģ? | A: Ch?c ch?n | B: Khōng bao gi? | C: Luōn luōn | D: Có l? | Šįp įn: D
map,męp,b?n d?,noun,-,-,maps,Can you show me on the map?,A diagram showing the layout of an area.,"world map, road map, map out","chart, plan, guide",—,A1,Transport & Travel,'World ___' — di?n t?: | A: test | B: game | C: map | D: message | Šįp įn: C
test,t?st,bąi ki?m tra,noun,-,-,tests,She passed her English test.,A set of questions to measure knowledge.,"take a test, pass a test, test result","exam, quiz, assessment","answer, solution",A1,Education,'Pass a ___' — di?n t?: | A: game | B: test | C: map | D: picture | Šįp įn: B
game,ge?m,trņ choi,noun,-,-,games,Let's play a board game tonight.,An activity done for fun with rules.,"video game, board game, team game","play, match, sport","work, study, task",A1,Entertainment & Leisure,'Video ___' — di?n t?: | A: test | B: map | C: game | D: message | Šįp įn: C
message,'m?s?d?,tin nh?n,noun,-,-,messages,I sent her a message this morning.,A written or spoken piece of information.,"send a message, text message, leave a message","note, text, email","call, silence",A2,Greetings & Communication,'Text ___' — di?n t?: | A: picture | B: message | C: map | D: test | Šįp įn: B
picture,'p?kt??r,b?c tranh,noun,-,-,pictures,She drew a beautiful picture.,"A drawing, painting, or photograph.","draw a picture, take a picture, picture book","image, photo, illustration","blank, emptiness",A1,Entertainment & Leisure,'Draw a ___' — di?n t?: | A: game | B: test | C: picture | D: message | Šįp įn: C
internet,'?nt?r?n?t,internet,noun,-,-,-,I use the internet every day.,A global network connecting millions of computers worldwide.,"browse the internet, internet connection, internet speed","web, network, online",offline,A2,Technology,'Internet' có nghia lą gģ? | A: Ši?n tho?i | B: Internet | C: Mįy in | D: Mąn hģnh | Šįp įn: B
email,'i?me?l,thu di?n t?,noun,-,-,emails,Please send me an email.,A system for sending messages electronically over the internet.,"send an email, reply to email, email address","message, mail, correspondence","letter, post",A2,Technology,T? nąo d?ng nghia v?i 'email'? | A: book | B: message | C: call | D: photo | Šįp įn: B
website,'w?bsa?t,trang web,noun,-,-,websites,Visit our website for more info.,A set of related web pages located under a single domain name.,"visit a website, official website, website design","web page, site, portal",—,A2,Technology,'Website' có nghia lą gģ? | A: Trang web | B: Email | C: Ph?n m?m | D: Mįy tķnh | Šįp įn: A
password,'pęsw??rd,m?t kh?u,noun,-,-,passwords,Enter your password to log in.,A secret word or phrase used to gain access to a system.,"set a password, strong password, forgot password","PIN, passcode, code",—,A2,Technology,'Password' có nghia lą gģ? | A: Mąn hģnh | B: M?t kh?u | C: Tźn dang nh?p | D: Tąi kho?n | Šįp įn: B
