English,IPA,Vietnamese,Part of Speech,V2 (Past),V3 (Past Participle),S/ES,Example Sentence,Description,Collocation,Synonyms,Antonyms,CEFR Level,Topic,Quiz Question
download,'da?nlo?d,t?i xu?ng,verb,downloaded,downloaded,downloads,I downloaded the app on my phone.,To copy data from the internet to your own device.,"download a file, download speed, free download","install, save, transfer",upload,A2,Technology,Trįi nghia c?a 'download' lą gģ? | A: install | B: save | C: upload | D: transfer | Šįp įn: C
elephant,'?l?f?nt,con voi,noun,-,-,elephants,The elephant is very large.,"The largest land animal, known for its long trunk and tusks.","baby elephant, elephant trunk, elephant herd",—,—,A1,Animals,'Elephant' có nghia lą gģ? | A: Con mčo | B: Con voi | C: Con chó | D: Con bņ | Šįp įn: B
tiger,'ta?g?r,con h?,noun,-,-,tigers,The tiger is a wild animal.,A large wild cat with orange and black stripes.,"wild tiger, tiger stripe, paper tiger","big cat, feline",—,A1,Animals,'Tiger' có nghia lą gģ? | A: Con su t? | B: Con g?u | C: Con h? | D: Con sói | Šįp įn: C
rabbit,'ręb?t,con th?,noun,-,-,rabbits,The rabbit ran across the field.,A small furry mammal with long ears and a short tail.,"pet rabbit, rabbit hole, wild rabbit","bunny, hare",—,A1,Animals,'Rabbit' có nghia lą gģ? | A: Con mčo | B: Con th? | C: Con chu?t | D: Con chim | Šįp įn: B
yellow,'j?lo?,mąu vąng,adjective,-,-,-,The sun is yellow.,"The color of gold, butter, or ripe lemons.","bright yellow, yellow light, yellow card","golden, amber, lemon",—,A1,Colors,'Yellow' có nghia lą gģ? | A: Mąu d? | B: Mąu xanh | C: Mąu vąng | D: Mąu tķm | Šįp įn: C
white,wa?t,mąu tr?ng,adjective,-,-,-,She wore a white dress.,"The lightest color, like snow or milk.","snow white, white shirt, white noise","ivory, pale, cream","black, dark",A1,Colors,Mąu 'white' lą mąu gģ? | A: Mąu den | B: Mąu tr?ng | C: Mąu xįm | D: Mąu nāu | Šįp įn: B
black,blęk,mąu den,adjective,-,-,-,He has black hair.,"The darkest color, like night or coal.","jet black, black hole, black market","dark, ebony","white, bright",A1,Colors,T? trįi nghia c?a 'black' lą gģ? | A: dark | B: ebony | C: white | D: grey | Šįp įn: C
orange,'??r?nd?,mąu cam,adjective,-,-,-,The pumpkin is orange.,A bright warm color between red and yellow.,"bright orange, orange light, orange sky","amber, tangerine",—,A1,Colors,'Orange' có nghia lą gģ khi dłng ląm mąu s?c? | A: Mąu tķm | B: Mąu cam | C: Mąu vąng | D: Mąu h?ng | Šįp įn: B
pink,p??k,mąu h?ng,adjective,-,-,-,She likes pink flowers.,A pale red color.,"light pink, hot pink, think pink","rose, blush, fuchsia",—,A1,Colors,'Pink' có nghia lą gģ? | A: Mąu xanh | B: Mąu vąng | C: Mąu h?ng | D: Mąu d? | Šįp įn: C
dress,dr?s,vįy d?m,noun,-,-,dresses,She wore a red dress.,A one-piece garment for women that covers the body and extends over the legs.,"wear a dress, summer dress, dress code","gown, frock, outfit",—,A1,Clothing & Accessories,'Dress' có nghia lą gģ? | A: Įo so mi | B: Qu?n | C: Vįy d?m | D: Įo khoįc | Šįp įn: C
jacket,'d?ęk?t,įo khoįc,noun,-,-,jackets,He put on his jacket before going out.,A short coat worn over other clothing.,"leather jacket, wear a jacket, jacket pocket","coat, blazer, cardigan",—,A1,Clothing & Accessories,'Jacket' có nghia lą gģ? | A: Įo so mi | B: Įo khoįc | C: Qu?n short | D: Mu | Šįp įn: B
hat,hęt,cįi mu,noun,-,-,hats,He wears a hat in the sun.,"A covering for the head, often with a brim.","wear a hat, straw hat, baseball hat","cap, bonnet, headwear",—,A1,Clothing & Accessories,'Hat' có nghia lą gģ? | A: Giąy | B: Cįi mu | C: Cįi tśi | D: Cįi vņng | Šįp įn: B
glasses,'glęs?z,kķnh m?t,noun,-,-,-,She wears glasses to read.,A pair of lenses in a frame worn in front of the eyes to correct vision.,"wear glasses, reading glasses, sunglasses","spectacles, eyewear, lenses",—,A2,Clothing & Accessories,'Glasses' du?c dłng d? ląm gģ? | A: Che mua | B: Š?c sįch | C: Ch?nh th? l?c | D: C? B vą C | Šįp įn: D
fruit,fru?t,trįi cāy,noun,-,-,fruits,I eat fruit every morning.,The sweet or sour produce of a plant that contains seeds.,"fresh fruit, tropical fruit, fruit juice","produce, harvest",vegetable,A1,Food & Drink,'Fruit' có nghia lą gģ? | A: Rau c? | B: Trįi cāy | C: Th?t | D: Ngu c?c | Šįp įn: B
vegetable,'v?d?t?b?l,rau c?,noun,-,-,vegetables,Eat more vegetables for good health.,A plant or part of a plant used as food.,"fresh vegetables, green vegetables, vegetable soup","greens, produce, plant","meat, fruit",A1,Food & Drink,'Vegetable' có nghia lą gģ? | A: Trįi cāy | B: Th?t | C: Rau c? | D: Bįnh | Šįp įn: C
soup,su?p,sśp / canh,noun,-,-,soups,She made a bowl of soup.,"A liquid dish made by cooking meat, vegetables, or other ingredients in water.","chicken soup, tomato soup, bowl of soup","broth, stew, bisque",—,A1,Food & Drink,'Soup' có nghia lą gģ? | A: Bįnh mģ | B: Sśp / Canh | C: Com | D: Mģ | Šįp įn: B
sugar,'??g?r,du?ng,noun,-,-,-,I add sugar to my coffee.,A sweet crystalline substance used to sweeten food and drinks.,"add sugar, brown sugar, sugar cane","sweetener, glucose",salt,A1,Food & Drink,T? trįi nghia ph? bi?n c?a 'sugar' khi nói v? v? lą gģ? | A: sweet | B: bitter | C: salt | D: sour | Šįp įn: C
salt,s??lt,mu?i,noun,-,-,-,Please pass me the salt.,A white crystalline substance used to season or preserve food.,"add salt, sea salt, salt and pepper","seasoning, sodium",sugar,A1,Food & Drink,'Salt' có nghia lą gģ? | A: Šu?ng | B: Mu?i | C: Tiźu | D: D?u | Šįp įn: B
meat,mi?t,th?t,noun,-,-,meats,We had grilled meat for dinner.,The flesh of an animal used as food.,"fresh meat, grilled meat, red meat","flesh, protein, beef",vegetable,A1,Food & Drink,'Meat' có nghia lą gģ? | A: Rau | B: Cį | C: Th?t | D: Tr?ng | Šįp įn: C
bed,b?d,cįi giu?ng,noun,-,-,beds,I go to bed at 10 PM.,A piece of furniture for sleeping or resting on.,"go to bed, make the bed, bed time","cot, bunk, mattress",—,A1,Home & Daily Life,'Bed' có nghia lą gģ? | A: Cįi bąn | B: Cįi gh? | C: Cįi giu?ng | D: Cįi t? | Šįp įn: C
kitchen,'k?t??n,nhą b?p,noun,-,-,kitchens,She cooks in the kitchen.,A room where food is prepared and cooked.,"kitchen table, open kitchen, kitchen sink","cooking area, galley",—,A1,Home & Daily Life,'Kitchen' lą noi dłng d? ląm gģ? | A: Ng? | B: N?u an | C: T?m | D: H?c bąi | Šįp įn: B
bathroom,'bę?ru?m,phņng t?m,noun,-,-,bathrooms,The bathroom is next to the bedroom.,"A room containing a bath or shower, and usually a toilet.","use the bathroom, clean the bathroom, bathroom mirror","washroom, restroom, toilet",—,A1,Home & Daily Life,'Bathroom' có nghia lą gģ? | A: Phņng ng? | B: Phņng khįch | C: Nhą b?p | D: Phņng t?m | Šįp įn: D
mirror,'m?r?r,guong,noun,-,-,mirrors,She looked in the mirror.,"A surface that reflects a clear image, usually made of glass.","look in the mirror, rear mirror, mirror image","reflection, glass",—,A2,Home & Daily Life,'Mirror' có nghia lą gģ? | A: C?a s? | B: Guong | C: Tranh | D: Ščn | Šįp įn: B
nose,no?z,cįi mui,noun,-,-,noses,My nose is running.,The part of the face used for smelling and breathing.,"runny nose, blow your nose, nose job","snout, nasal",—,A1,Health & Body,'Nose' có nghia lą gģ? | A: Tai | B: M?t | C: Mui | D: Mi?ng | Šįp įn: C
mouth,ma??,cįi mi?ng,noun,-,-,mouths,Open your mouth wide.,The opening in the face used for eating and speaking.,"open your mouth, shut your mouth, word of mouth","lips, oral",—,A1,Health & Body,'Mouth' có nghia lą gģ? | A: Mui | B: Tai | C: M?t | D: Mi?ng | Šįp įn: D
ear,??r,cįi tai,noun,-,-,ears,She whispered in my ear.,The organ of hearing on the side of the head.,"listen with ears, ear infection, keep an ear out",—,—,A1,Health & Body,'Ear' có nghia lą gģ? | A: M?t | B: Mui | C: Tai | D: Mi?ng | Šįp įn: C
tooth,tu??,cįi rang,noun,-,-,teeth,Brush your teeth twice a day.,One of the hard white structures in the mouth used for biting and chewing.,"brush teeth, tooth pain, sweet tooth","fang, molar",—,A1,Health & Body,'Tooth' có nghia lą gģ? | A: Mōi | B: Lu?i | C: Rang | D: Nu?u | Šįp įn: C
leg,l?g,cįi chān,noun,-,-,legs,He broke his leg.,One of the limbs of the body used for standing and walking.,"break a leg, stretch your legs, leg room","limb, lower limb",arm,A1,Health & Body,'Leg' có nghia lą gģ? | A: Tay | B: Chān | C: Lung | D: Ng?c | Šįp įn: B
university,?ju?n?'v??rs?ti,tru?ng d?i h?c,noun,-,-,universities,She studies at a university.,An institution of higher education offering undergraduate and postgraduate degrees.,"go to university, top university, university degree","college, institution, academy",school,A2,Education,'University' có nghia lą gģ? | A: Tru?ng m?u giįo | B: Tru?ng ti?u h?c | C: Tru?ng trung h?c | D: Tru?ng d?i h?c | Šįp įn: D
exam,?g'zęm,k? thi,noun,-,-,exams,I have an exam tomorrow.,A formal test of knowledge or ability.,"take an exam, pass an exam, final exam","test, assessment, evaluation",—,A2,Education,'Exam' có nghia lą gģ? | A: Bąi t?p | B: K? thi | C: L?p h?c | D: Sįch giįo khoa | Šįp įn: B
homework,'ho?mw??rk,bąi t?p v? nhą,noun,-,-,-,I finished my homework.,School work that a student is required to do at home.,"do homework, finish homework, homework assignment","assignment, task, schoolwork",—,A1,Education,'Homework' có nghia lą gģ? | A: Vi?c nhą | B: Bąi t?p v? nhą | C: Sįch giįo khoa | D: Ši?m s? | Šįp įn: B
library,'la?br?ri,thu vi?n,noun,-,-,libraries,She borrowed books from the library.,A building or room where books and other materials are kept for reading or borrowing.,"public library, visit the library, library card","archive, reading room",—,A2,Education,'Library' có nghia lą gģ? | A: Hi?u sįch | B: Thu vi?n | C: L?p h?c | D: Van phņng | Šįp įn: B
salary,'sęl?ri,luong,noun,-,-,salaries,He gets a good salary.,A fixed amount of money paid to an employee regularly for their work.,"high salary, monthly salary, salary raise","wage, pay, income",—,A2,Work & Money,'Salary' có nghia lą gģ? | A: Chi phķ | B: Thu? | C: Luong | D: Ti?n thu?ng | Šįp įn: C
bank,bę?k,ngān hąng,noun,-,-,banks,I go to the bank every Friday.,A financial institution that keeps money and offers loans.,"open a bank account, go to the bank, bank transfer","financial institution, credit union",—,A2,Work & Money,'Bank' có nghia lą gģ? | A: Ch? | B: Ngān hąng | C: Buu di?n | D: Siźu th? | Šįp įn: B
meeting,'mi?t??,cu?c h?p,noun,-,-,meetings,We have a meeting at 9 AM.,An occasion when people come together to discuss something.,"hold a meeting, attend a meeting, business meeting","conference, gathering, session",—,A2,Work & Money,'Meeting' có nghia lą gģ? | A: Ti?c | B: Cu?c h?p | C: Bu?i hņa nh?c | D: L?p h?c | Šįp įn: B
airplane,'?rple?n,mįy bay,noun,-,-,airplanes,We took an airplane to Paris.,A powered flying vehicle with wings.,"take an airplane, airplane ticket, airplane seat","aircraft, plane, jet",—,A1,Transport & Travel,'Airplane' có nghia lą gģ? | A: Xe l?a | B: Tąu thuy?n | C: Mįy bay | D: Xe bużt | Šįp įn: C
passport,'pęsp??rt,h? chi?u,noun,-,-,passports,Show your passport at the border.,An official government document for international travel.,"valid passport, check passport, passport control","travel document, ID",—,A2,Transport & Travel,'Passport' có nghia lą gģ? | A: Vé tąu | B: B?n d? | C: H? chi?u | D: Th? can cu?c | Šįp įn: C
hotel,ho?'t?l,khįch s?n,noun,-,-,hotels,We stayed in a nice hotel.,A building providing paid accommodation and meals.,"book a hotel, five-star hotel, hotel room","inn, lodge, resort",—,A1,Transport & Travel,T? d?ng nghia c?a 'hotel' lą gģ? | A: house | B: inn | C: school | D: office | Šįp įn: B
concert,'k?ns?rt,bu?i hņa nh?c,noun,-,-,concerts,I went to a concert last night.,A live performance of music before an audience.,"attend a concert, live concert, rock concert","show, performance, gig",—,A2,Entertainment & Leisure,'Concert' có nghia lą gģ? | A: B? phim | B: Bu?i hņa nh?c | C: Trņ choi | D: Tri?n lćm | Šįp įn: B
hobby,'h?bi,s? thķch,noun,-,-,hobbies,My hobby is painting.,An activity done regularly in one's leisure time for pleasure.,"take up a hobby, favorite hobby, hobby class","interest, pastime, activity","work, duty",A2,Entertainment & Leisure,'Hobby' có nghia lą gģ? | A: Cōng vi?c | B: S? thķch | C: Mōn h?c | D: Ngh? nghi?p | Šįp įn: B
vacation,ve?'ke???n,k? ngh?,noun,-,-,vacations,We went on vacation to the beach.,A period of time spent away from work or school for rest and travel.,"go on vacation, summer vacation, vacation trip","holiday, break, trip",work,A2,Entertainment & Leisure,'Vacation' có nghia lą gģ? | A: Cu?c h?p | B: K? ngh? | C: Cōng vi?c | D: Bu?i h?c | Šįp įn: B
earthquake,'??r?kwe?k,d?ng d?t,noun,-,-,earthquakes,There was a big earthquake in Japan.,A sudden violent shaking of the ground caused by movements in the earth's crust.,"major earthquake, earthquake damage, earthquake zone","tremor, quake, seismic event",—,A2,Nature & Weather,'Earthquake' có nghia lą gģ? | A: Bćo | B: Lu l?t | C: Š?ng d?t | D: Nśi l?a | Šįp įn: C
flood,fl?d,lu l?t,noun,-,-,floods,The flood destroyed many homes.,An overflow of water that submerges land.,"flash flood, flood warning, flood damage","inundation, overflow, deluge",drought,A2,Nature & Weather,T? trįi nghia c?a 'flood' lą gģ? | A: rain | B: drought | C: storm | D: river | Šįp įn: B
forest,'f??r?st,r?ng,noun,-,-,forests,The forest is full of wildlife.,A large area of land covered with trees.,"tropical forest, deep forest, forest fire","woodland, jungle, woods","desert, city",A1,Nature & Weather,'Forest' có nghia lą gģ? | A: Š?ng c? | B: Sa m?c | C: R?ng | D: Š?i duong | Šįp įn: C
storm,st??rm,bćo,noun,-,-,storms,A big storm hit the coast.,A violent disturbance of the atmosphere with strong wind and rain.,"thunderstorm, storm warning, weather storm","tempest, hurricane, typhoon","calm, sunshine",A2,Nature & Weather,'Storm' có nghia lą gģ? | A: Gió nh? | B: Mua phłn | C: Bćo | D: Suong mł | Šįp įn: C
angry,'ę?gri,t?c gi?n,adjective,-,-,-,He was angry at the result.,Feeling or showing strong annoyance or displeasure.,"feel angry, get angry, angry voice","furious, mad, irritated","calm, happy, peaceful",A1,Thinking & Feelings,T? trįi nghia c?a 'angry' lą gģ? | A: furious | B: calm | C: mad | D: irritated | Šįp įn: B
